"Status","Start Time","Stop Time","Duration in ms","Parent Suite","Suite","Sub Suite","Test Class","Test Method","Name","Description"
"passed","Tue Apr 07 21:56:22 UTC 2026","Tue Apr 07 21:56:22 UTC 2026","423","","tests.DogApiPositiveTests","","tests.DogApiPositiveTests","shouldReturnImagesForExistingBreed","Retorna lista de URLs válidas para raça existente","Valida retorno de lista de imagens para uma raça existente."
"passed","Tue Apr 07 21:56:20 UTC 2026","Tue Apr 07 21:56:22 UTC 2026","1909","","tests.DogApiPositiveTests","","tests.DogApiPositiveTests","shouldReturnBreedsListWithExpectedStructure","Retorna mapa de raças com status success","Confere status HTTP, contrato JSON e estrutura do payload de raças/sub-raças."
"passed","Tue Apr 07 21:56:22 UTC 2026","Tue Apr 07 21:56:23 UTC 2026","189","","tests.DogApiPositiveTests","","tests.DogApiPositiveTests","shouldReturnValidRandomImage","Retorna URL válida ao solicitar imagem randômica","Confere se o endpoint random entrega uma URL de imagem válida."
"passed","Tue Apr 07 21:56:23 UTC 2026","Tue Apr 07 21:56:23 UTC 2026","162","","tests.DogApiNegativeTests","","tests.DogApiNegativeTests","shouldValidatePayloadDefensively","Valida estrutura defensiva com campos obrigatórios e tipos","Executa validações defensivas para garantir formato mínimo e tipos esperados."
"passed","Tue Apr 07 21:56:23 UTC 2026","Tue Apr 07 21:56:23 UTC 2026","202","","tests.DogApiNegativeTests","","tests.DogApiNegativeTests","shouldReturnErrorForInvalidBreed","Retorna status error para raça inválida","Valida resposta de erro para raça inexistente em /breed/{breed}/images."
